{
  "username": "",
  "password": "",
  "host": "",
  "remote_path": "/",
  "port": 21,
  "upload_on_save": true,
  "autosync": false,
  "autosync_secs": 120,
  "discover": true,
  "protocol": "ftps",
  "passive": true,
  "ignore_always": [
    "**/.ssh/**",
    "**/.wsftp-*.tmp",
    "/^(?:\\.git|\\.vscode|node_modules)(?:/|$)/",
    "/(?:^|/)\\.env(?:\\.[^/]*)?$/",
    "/\\.(?:pem|key)$/",
    "/(?:^|/)id_(?:rsa|ed25519)$/"
  ],
  "ignore_upload": [
  ],
  "ignore_download": [
  ],
  "debug": true
}


